{
  "schemaVersion": "1.0",
  "intentId": "why-ppagent-agenda",
  "assetId": "radial-hub-001",
  "parameters": {
    "title": "从一个耗时问题，到一套可复用系统",
    "center": "为什么做 PPagenT",
    "items": [
      "昂贵的是判断",
      "工作需要稳定",
      "AI、规则、代码分工",
      "稳定 80 分",
      "服务多数人",
      "积累的是能力"
    ]
  },
  "mappings": [
    {
      "sourceItemId": "topic-1",
      "parameterPath": "items[0]"
    },
    {
      "sourceItemId": "topic-2",
      "parameterPath": "items[1]"
    },
    {
      "sourceItemId": "topic-3",
      "parameterPath": "items[2]"
    },
    {
      "sourceItemId": "topic-4",
      "parameterPath": "items[3]"
    },
    {
      "sourceItemId": "topic-5",
      "parameterPath": "items[4]"
    },
    {
      "sourceItemId": "topic-6",
      "parameterPath": "items[5]"
    }
  ],
  "omissions": []
}
